{
  "schema": 1,
  "id": "pmmu/moves-sfc-dfc-fault-restart",
  "description": "With separate SRP and CRP roots, four independently faulted MOVES.B SFC/DFC transfers restart through an unmodified format-B RTE, preserve postincrement and predecrement updates, and complete on a translated supervisor stack.",
  "authority": [
    "MC68030 User's Manual, section 8.1.2: format-A and format-B bus-error frames",
    "MC68030 User's Manual, Table 8-6: format-B bus-error stack frame",
    "M68000 Family Programmer's Reference Manual: MOVES and RTE"
  ],
  "derived_from": [
    "fpga/cpu/tg68k_c_030_mmu2/tests/upstream/tb_mmu_restart_moves_dfc.vhd"
  ],
  "requires": [
    "mc68030",
    "pmmu",
    "format-b-frame"
  ],
  "initial": {
    "reset": true,
    "memory": [
      {
        "address": "0x00000000",
        "data": "000020000000010000000080"
      },
      {
        "address": "0x00000080",
        "data": "52b900001f0023cf00001f242f0e23fc00007c61000070002c7c1dfffff5f01638102c5f4e73"
      },
      {
        "address": "0x000000c0",
        "data": "23fc00ff000000001f004e722700"
      },
      {
        "address": "0x00000100",
        "data": "2e7c00001080f0174c002e7c00001088f0174800f0002400f038400010904e714e7170014e7b00004e7b0001243c123456a52e7c0bafa0000e3928001dfffff523fcbadfeed0000070002c7c1dfffff5f0163810227c1dfffff60e19280023c900001f3023fcbadfeed0000070002c7c1dfffff5f0163810765a227c1dfffff80e21380023c900001f3423fcbadfeed0000070002c7c1dfffff5f0163810247c1dfffff878000e1a400023ca00001f3823c400001f3c23fcc0de700d00001f2c60fe"
      },
      {
        "address": "0x00001080",
        "data": "800000024faa6000800000024052c00082a08680"
      },
      {
        "address": "0x00006800",
        "data": "00006e02"
      },
      {
        "address": "0x000069ac",
        "data": "00006f02"
      },
      {
        "address": "0x00006e00",
        "data": "00000061"
      },
      {
        "address": "0x00006e10",
        "data": "00001061"
      },
      {
        "address": "0x00006e1c",
        "data": "00001c61"
      },
      {
        "address": "0x00006e70",
        "data": "00007061"
      },
      {
        "address": "0x00007000",
        "data": "badfeed0"
      },
      {
        "address": "0x0000729c",
        "data": "00006061"
      },
      {
        "address": "0x00007ff4",
        "data": "00000000c300"
      },
      {
        "address": "0x4052c000",
        "data": "00006802"
      },
      {
        "address": "0x4052c02c",
        "data": "00006902"
      },
      {
        "address": "0x4faa6074",
        "data": "4faa7002"
      },
      {
        "address": "0x4faa70fc",
        "data": "4faa8002"
      },
      {
        "address": "0x4faa83fc",
        "data": "00007002"
      }
    ]
  },
  "run": {
    "mode": "memory",
    "max_cycles": 50000,
    "stop": {
      "address": "0x00001f2c",
      "mask": "0xffffffff",
      "value": "0xc0de700d"
    }
  },
  "observe": [
    {
      "address": "0x00001f00",
      "length": 4
    },
    {
      "address": "0x00001f24",
      "length": 4
    },
    {
      "address": "0x00001f2c",
      "length": 20
    },
    {
      "address": "0x000063a4",
      "length": 28
    },
    {
      "address": "0x00007000",
      "length": 4
    },
    {
      "address": "0x00007ff4",
      "length": 6
    }
  ],
  "expect": {
    "terminal": "memory",
    "memory": [
      {
        "address": "0x00001f00",
        "data": "00000004"
      },
      {
        "address": "0x00001f24",
        "data": "0baf9fa4"
      },
      {
        "address": "0x00001f2c",
        "data": "c0de700d1dfffff71dfffff71dfffff9000000c3"
      },
      {
        "address": "0x000063a6",
        "data": "000001a6"
      },
      {
        "address": "0x000063aa",
        "data": "b008"
      },
      {
        "address": "0x000063ae",
        "data": "0151",
        "mask": "01f7"
      },
      {
        "address": "0x000063b4",
        "data": "1dfffff8"
      },
      {
        "address": "0x00007000",
        "data": "00007c01",
        "mask": "ffffff03"
      },
      {
        "address": "0x00007ff4",
        "data": "00a5a55ac300"
      }
    ]
  }
}
